,gen,var,Abs,doi
PTPN11,T73I,"Mutations in the PTPN11 gene are known to cause a large fraction of the cases of Noonan syndrome. The objective of this study was to determine the PTPN11 gene mutation rate in a cohort of clinically well-characterized Brazilian patients with Noonan or Noonan-like syndromes and to study the genotype-phenotype correlation. Fifty probands with Noonan syndrome ascertained according to well-established diagnostic criteria, 3 with LEOPARD syndrome, 5 with Noonan-like/multiple giant cell lesion syndrome, and 3 with neurofibromatosis/ Noonan were enrolled in this study. Mutational analysis was performed using denaturing high-performance liquid chromatography (DHPLC) followed by sequencing of amplicons with an aberrant elution profile. We detected missense mutations in the PTPN11 gene in 21 probands with Noonan syndrome (42%), in all 3 patients with LEOPARD syndrome, and in 1 case with Noonan-like/multiple giant cell lesion syndrome. One patient with neurofibromatosis-Noonan syndrome had a mutation in both the PTPN11 and NF1 genes. The only anomalies that reached statistical significance when comparing probands with and without mutations were the hematological abnormalities. Our data confirms that Noonan syndrome is a genetically heterogeneous disorder, with mutations in the PTPN11 gene responsible for roughly 50% of the cases. A definitive genotype-phenotype correlation has not been established, but the T73I mutation seems to predispose to a myeloproliferative disorder. Regarding Noonan-like syndromes, mutation of the PTPN11 gene is the main causal factor in LEOPARD syndrome, and it also plays a role in neurofibromatosis-Noonan syndrome. Noonan- like/multiple giant cell lesion syndrome, part of the spectrum of Noonan syndrome, is also heterogeneous.",10.1089/gte.2006.10.186
PTPN11,T73I,"Germ line PTPN11 mutations cause 50% of cases of Noonan syndrome (NS). Somatic mutations in PTPN11 occur in 35% of patients with de novo, nonsyndromic juvenile myelomonocytic leukemia (JMML). Myeloproliferative disorders (MPDs), either transient or more fulminant forms, can also occur in infants with NS (NS/MPD). We identified PTPN11 mutations in blood or bone marrow specimens from 77 newly reported patients with JMML (n = 69) or NS/MPD (n = 8). Together with previous reports, we compared the spectrum of PTPN11 mutations in 3 groups: (1) patients with JMML (n = 107); (2) patients with NS/MPD (n = 19); and (3) patients with NS (n = 243). Glu76 was the most commonly affected residue in JMML (n = 45), with the Glu76Lys alteration (n = 29) being most frequent. Eight of 19 patients with NS/MPD carried the Thr73Ile substitution. These data suggest that there is a genotype/phenotype correlation in the spectrum of PTPN11 mutations found in patients with JMML, NS/MPD, and NS. This supports the need to characterize the spectrum of hematologic abnormalities in individuals with NS and to better define the impact of the PTPN11 lesion on the disease course in patients with NS/MPD and JMML.",10.1182/blood-2005-02-0531
PTPN11,T73I,"Noonan syndrome (NS) is an autosomal dominant disorder, characterized by short stature, minor facial anomalies, and congenital heart defects. In approximately 50% of cases the condition is caused by missense mutations in the PTPN11 gene on chromosome 12, resulting in a gain of function of the protein SHP-2. In this study, PTPN11 mutation analysis was performed in 170 NS patients. In 76 (45%) of them a mutation was identified. We report on the distribution of these mutations, as well as on genotype-phenotype relationships. The benefit of the NS scoring system developed by van der Burgt et al. [(1994); Am J Med Genet 53:187-191] is shown, among physicians who consequently based their diagnosis on the NS scoring system the percentage mutation positive subjects was 54%, whereas this percentage was only 39% among physicians who made less use of the scoring system. In two patients with some uncommon manifestations mutations were found in the C-SH2 domain, a region in which defects are not often identified in NS. A trend was observed in patients carrying the 922A --> G change (Asn308Asp) receiving normal education. In one patient with NS and mild juvenile myelomonocytic leukemia (JMML) the mutation 218C --> T (Thr73Ile) was found. This confirms previous findings indicating that individuals with NS with specific mutations in PTPN11 are at risk of developing JMML.",10.1002/ajmg.a.30598
PTPN11,T73I,"Noonan syndrome is an autosomal dominant disorder defined by short stature, delayed puberty, and characteristic dysmorphic features. Tartaglia et al. (Nature Genetics, 29:465-468) have recently shown that gain-of-function mutations in the gene PTPN11 (protein-tyrosine phosphatase, nonreceptor-type 11) cause Noonan syndrome in roughly half of patients that they examined. To further explore the relevance of PTPN11 mutations to the pathogenesis of Noonan syndrome, we analyzed the PTPN11 gene in 21 Japanese patients. Mutation analysis of the 15 coding exons and their flanking introns by denaturing HPLC and direct sequencing revealed six different heterozygous missense mutations (Asp61Gly, Tyr63Cys, Ala72Ser, Thr73Ile, Phe285Ser, and Asn308Asp) in seven cases (six sporadic and one familial). The mutations clustered either in the N-Src homology 2 domain or in the protein-tyrosine phosphatase domain. The clinical features of the mutation-positive and mutation-negative patients were comparable. The results provide further support to the notion that PTPN11 mutations are responsible for the development of Noonan syndrome in a substantial fraction of patients and that relatively infrequent features of Noonan syndrome, such as sensory deafness and bleeding diathesis, can also result from mutations of PTPN11.",10.1210/jcem.87.8.8694
PTPN11,E76D,"Molecular analysis of the gene encoding the protein tyrosine phospatase, nonreceptor type 11 (PTPN11), identified a single base change at nucleotide 228 in an individual manifesting Noonan syndrome with aortic root widening and dysplastic aortic and mitral valves. This missense mutation changes glutamate to aspartate at position 76 of the protein (E76D or Glu76Asp), which likely disrupts intramolecular hydrogen bonding of this protein. There are few reports of aortic root dilatation in Noonan syndrome, and to our knowledge this is the first case with a confirmed PTPN11 mutation.",10.1007/s00246-006-1210-x
PTPN11,E76K,"Mutations in PTPN11, which encodes the protein tyrosine phosphatase SHP2, contribute to ∼35% of cases of juvenile myelomonocytic leukemia (JMML). A common clinical picture in children with JMML is that it presents as a constitutive hyperinflammatory syndrome, partially reminiscent of chronic myelomonocytic leukemia in adults. Thus, a component of JMML is associated with a hyperinflammatory state and abundant innate immune cells such as neutrophils and monocytes. Recently, we showed that the evolutionarily conserved mouse lncRNA Morrbid is specifically expressed in myeloid cells and uniquely represses the expression of the proapoptotic gene Bim to regulate the lifespan of myeloid cells. However, its role in JMML has not been investigated. In this study, we characterized the role of Morrbid and its target Bim, which are significantly dysregulated in Shp2E76K/+-bearing myeloid cells, in driving JMML. Loss of Morrbid in a mouse model of JMML driven by the Shp2E76K/+ mutation resulted in a significant correction of myeloid and erythroid cell abnormalities associated with JMML, including overall survival. Consistently, patients with JMML who had PTPN11, KRAS, and NRAS mutations and high expression of MORRBID manifested poor overall survival. Our results suggest that Morrbid contributes to JMML pathogenesis.",10.1182/bloodadvances.2020002123
PTPN11,E76K,"B-cell acute lymphoblastic leukemia (B-ALL) is immune to the chemotherapy-induced apoptosis as a result of the protection of bone marrow mesenchymal stromal cells (BMSCs). However, the precise underlying mechanism of such protection remains unclear so far. In this experiment, protein tyrosine phosphatase 2 (Shp2), which was encoded by the PTPN11 gene, was highly expressed in BMSCs of the newly diagnosed and the recurrent B-ALL patients. The plasmid-induced (including Shp2 E76K) Shp2 activation in BMSCs (Shp2-activated BMSCs) markedly increased the BMSCs-mediated resistance of leukemia cells both in vitro and in vivo. Additionally, studies in vitro suggested that, the expression of vascular cell adhesion molecule 1 (VCAM-1) was markedly up-regulated in Shp2-activated BMSCs, and VCAM-1 expression in BMSCs of B-ALL patients was negatively correlated with Shp2 expression. Down-regulation of VCAM-1 in BMSCs using siRNA reversed the resistance of CCRF-SB cells mediated by the Shp2-activated BMSCs. As for the molecular mechanism, the PI3K/AKT pathway mediated the regulation of VCAM-1 by Shp2. Blocking the very late antigen-4 (VLA-4) by antibodies in CCRF-SB cells dramatically reversed the resistance of CCRF-SB cells mediated by the Shp2-activated BMSCs, and decreased the adhesion effects of both CCRF-SB cells and BMSCs. In conclusion, Shp2 activation in BMSCs up-regulates VCAM-1 expression through increasing the PI3K/AKT phosphorylation level, and targeting the VCAM-1/VLA-4 signaling may serve as a clinically relevant mechanism to overcome the BMSCs-mediated chemoresistance of B-ALL cells.",10.1016/j.intimp.2019.106008
PTPN11,E76K,The nonreceptor protein-tyrosine phosphatase (PTP) SHP2 is encoded by the proto-oncogene ,10.1074/jbc.RA119.010838
PTPN11,E76K,"While the genetic contributions to the predisposition of Bernese mountain dogs (BMDs) to histiocytic sarcoma (HS) remains unclear, some insights into key genetic drivers have been gained. Our group recently reported a mutation in the ",10.3390/genes10070505
PTPN11,E76K,"Activating mutations in PTPN11, encoding the cytosolic protein tyrosine phosphatase SHP2, result in developmental disorders and act as oncogenic drivers in patients with hematologic cancers. The allosteric inhibitor SHP099 stabilizes the wild-type SHP2 enzyme in an autoinhibited conformation that is itself destabilized by oncogenic mutations. Here, we report the impact of the highly activated and most frequently observed mutation, E76K, on the structure of SHP2, and investigate the effect of E76K and other oncogenic mutations on allosteric inhibition by SHP099. SHP2",10.1038/s41467-018-06823-9
PTPN11,E76K,"Melanoma is one of the most highly mutated cancer types. To identify functional drivers of melanoma, we searched for cross-species conserved mutations utilizing a mouse melanoma model driven by loss of PTEN and CDKN2A, and identified mutations in ",10.1158/1541-7786.MCR-18-0777
PTPN11,E76K,"Histiocytic sarcoma in humans is an aggressive orphan disease with a poor prognosis as treatment options are limited. Dogs are the only species that spontaneously develops histiocytic sarcoma with an appreciable frequency, and may have value as a translational model system. In the current study, high-throughput drug screening utilizing histiocytic sarcoma cells isolated from canine neoplasms identified these cells as particularly sensitive to a MEK inhibitor, trametinib. One of the canine cell lines carries a mutation in PTPN11 (E76K), and another one in KRAS (Q61H), which are associated with the activation of oncogenic MAPK signaling. Both mutations were previously reported in human histiocytic sarcoma. Trametinib inhibited sensitive cell lines by promoting cell apoptosis, indicated by a significant increase in caspase 3/7. Furthermore, ",10.1158/1535-7163.MCT-17-1273
PTPN11,E76K,"Juvenile myelomonocytic leukemia (JMML) is an uncommon myeloproliferative neoplasm driven by Ras pathway mutations and hyperactive Ras/MAPK signaling. Outcomes for many children with JMML remain dismal with current standard-of-care cytoreductive chemotherapy and hematopoietic stem cell transplantation. We used patient-derived induced pluripotent stem cells (iPSCs) to characterize the signaling profiles and potential therapeutic vulnerabilities of PTPN11-mutant and CBL-mutant JMML. We assessed whether MEK, JAK, and PI3K/mTOR kinase inhibitors (i) could inhibit myeloproliferation and aberrant signaling in iPSC-derived hematopoietic progenitors with PTPN11 E76K or CBL Y371H mutations. We detected constitutive Ras/MAPK and PI3K/mTOR signaling in PTPN11 and CBL iPSC-derived myeloid cells. Activated signaling and growth of PTPN11 iPSCs were preferentially inhibited in vitro by the MEKi PD0325901 and trametinib. Conversely, JAK/STAT signaling was selectively activated in CBL iPSCs and abrogated by the JAKi momelotinib and ruxolitinib. The PI3Kδi idelalisib and mTORi rapamycin inhibited signaling and myeloproliferation in both PTPN11 and CBL iPSCs. These findings demonstrate differential sensitivity of PTPN11 iPSCs to MEKi and of CBL iPSCs to JAKi, but similar sensitivity to PI3Ki and mTORi. Clinical investigation of mutation-specific kinase inhibitor therapies in children with JMML may be warranted.",10.1038/s41375-018-0169-y
PTPN11,E76K,Catalytically activating mutations in ,10.1126/scisignal.aao1591
PTPN11,E76K,"SHP2 is encoded by the protein tyrosine phosphatase 11 (Ptpn11) gene. Several gain-of-function (GOF) mutations in Ptpn11 have been identified in human hematopoietic malignancies and solid tumors. In addition, the mutation rate for SHP2 is the highest for colorectal cancer (CRC) among solid tumors. The E76K GOF mutation is the most common and active SHP2 mutation; however, the pathogenic effects and function of this mutation in CRC tumor progression have not been well characterized. The Wnt/β-catenin (CTNNB1) signaling pathway is crucial for CRC, and excessive activation of this pathway has been observed in several tumors. We used Ptpn11",10.1002/mc.22785
PTPN11,E76K,"We report an unusual case of epithelioid angiosarcoma (AS) mimicking an epithelioid hemangioma (EH) and analyze mutational patterns in EHs and ASs.
A 58-year-old woman presented with a finger lump and metastatic lung nodules. Initial needle biopsies showed an EH, with only focal atypical histologic features. The patient underwent finger amputation and resection of lung nodules. The amputation specimen and lung nodules revealed features of AS. Fluorescence in situ hybridization for FOS and FOSB gene rearrangements were negative in the primary tumor as well as in the lung metastasis. Intrigued by the unique morphologic features of an AS masquerading as an EH, we expanded our study by analyzing mutations in EHs versus ASs using a targeted next-generation sequencing of 50 cancer-related genes. Seven EHs and 6 ASs including the present case were subjected to mutation analysis using the Ion AmpliSeq Cancer Hotspot Panel v2 assay of 50 cancer-related genes. The present case lacked mutation. Novel somatic variants were detected in 2 of 7 EHs and 1 of 6 ASs. Sorting intolerant from tolerant and polymorphism phenotyping analysis revealed benign/tolerated and deleterious variants in both tumor types. Deleterious variants TP53 c.707T>C (p.Tyr236Cys), FLT3 c.1995C>T (p.Met665Ile), and SMO c.1919C>T (p.Thr640Ile) were detected in EH, while AS revealed deleterious variant PTPN11 c.226G>A (p.Glu76Lys).
We present an epithelioid AS mimicking EH. We report novel somatic variants in EHs and AS. Benign variants may not be associated with development of these tumors. Whereas, deleterious variants, especially PTPN11 c.226G>A, may be linked to tumorigenesis of AS.",10.1097/PAI.0000000000000551
PTPN11,E76K,"Accumulating evidence suggests the origin of juvenile myelomonocytic leukemia (JMML) is closely associated with fetal development. Nevertheless, the contribution of embryonic progenitors to JMML pathogenesis remains unexplored. We hypothesized that expression of JMML-initiating PTPN11 mutations in HSC-independent yolk sac erythromyeloid progenitors (YS EMPs) would result in a mouse model of pediatric myeloproliferative neoplasm (MPN).
E9.5 YS EMPs from VavCre+;PTPN11
YS EMPs expressing mutant PTPN11 demonstrate functional and molecular features of JMML but do not cause disease following transplantation nor following unperturbed development. Developmental Dynamics 246:1001-1014, 2017. © 2017 Wiley Periodicals, Inc.",10.1002/dvdy.24598
PTPN11,E76K,"Histiocytic sarcoma (HS) is an aggressive malignant neoplasm of dendritic cell origin that is common in certain breeds of dogs. High prevalence of fatal, disseminated HS has been described in Bernese Mountain Dogs (BMDs). Support for genetic predisposition to develop HS has been presented in several studies, but to date, causative genetic events have not been reported. In addition, no driver mutations have been identified in tumours. Recently, E76K gain-of-function mutation in SHP2 encoded by the PTPN11 gene has been described in human histiocytic malignancies. In our study, we identified the PTPN11",10.1111/vco.12357
PTPN11,E76K,"Activating mutations, such as E76K and D61Y, in PTPN11 (SHP2), a protein tyrosine phosphatase implicated in multiple cell signaling processes, are associated with 35% of patients with juvenile myelomonocytic leukemia (JMML), an aggressive childhood myeloproliferative neoplasm (MPN). Here we show that the interaction between leukemia-associated mutant Shp2 and Gab2, a scaffolding protein important for cytokine-induced PI3K/Akt signaling, was enhanced, and that the mTOR pathway was elevated in Ptpn11",10.1038/leu.2016.326
PTPN11,E76K,"After allogeneic stem-cell transplantation, nonhematopoietic tissues contain donor-derived cells; however, whether cells from malignant hematological disease can also be found in nonhematopoietic tissues is unclear. This report describes a juvenile myelomonocytic leukemia (JMML) case with a typical PTPN11 mutation (p.E76K) at different allele frequencies in the bone marrow mononuclear cells, buccal smear cells, and fingernails at diagnosis, which was suggestive of PTPN11 somatic mosaicism; however, the PTPN11 mutation in the buccal smear cells and fingernails was lost after unrelated cord blood transplantation. These results suggest that JMML-derived cells may migrate into and reside in nonhematopoietic tissues and furthermore that these cells can be eradicated by cord blood transplantation. ",10.1007/s12185-015-1877-y
PTPN11,E76K,"Macrophages are vital to innate immunity and express pattern recognition receptors and integrins for the rapid detection of invading pathogens. Stimulation of Dectin-1 and complement receptor 3 (CR3) activates Erk- and Akt-dependent production of reactive oxygen species (ROS). Shp2, a protein-tyrosine phosphatase encoded by Ptpn11, promotes activation of Ras-Erk and PI3K-Akt and is crucial for hematopoietic cell function; however, no studies have examined Shp2 function in particulate-stimulated ROS production. Maximal Dectin-1-stimulated ROS production corresponded kinetically to maximal Shp2 and Erk phosphorylation. Bone marrow-derived macrophages (BMMs) from mice with a conditionally deleted allele of Ptpn11 (Shp2(flox/flox);Mx1Cre+) produced significantly lower ROS levels compared with control BMMs. Although YFP-tagged phosphatase dead Shp2-C463A was strongly recruited to the early phagosome, its expression inhibited Dectin-1- and CR3-stimulated phospho-Erk and ROS levels, placing Shp2 phosphatase function and Erk activation upstream of ROS production. Further, BMMs expressing gain of function Shp2-D61Y or Shp2-E76K and peritoneal exudate macrophages from Shp2D61Y/+;Mx1Cre+ mice produced significantly elevated levels of Dectin-1- and CR3-stimulated ROS, which was reduced by pharmacologic inhibition of Erk. SIRPα (signal regulatory protein α) is a myeloid inhibitory immunoreceptor that requires tyrosine phosphorylation to exert its inhibitory effect. YFP-Shp2C463A-expressing cells have elevated phospho-SIRPα levels and an increased Shp2-SIRPα interaction compared with YFP-WT Shp2-expressing cells. Collectively, these findings indicate that Shp2 phosphatase function positively regulates Dectin-1- and CR3-stimulated ROS production in macrophages by dephosphorylating and thus mitigating the inhibitory function of SIRPα and by promoting Erk activation. ",10.1074/jbc.M114.614057
PTPN11,E76K,"Lung cancer is a major disease carrying heterogeneous molecular lesions and many of them remain to be analyzed functionally in vivo. Gain-of-function (GOF) SHP2 (PTPN11) mutations have been found in various types of human cancer, including lung cancer. However, the role of activating SHP2 mutants in lung cancer has not been established. We generated transgenic mice containing a doxycycline (Dox)-inducible activating SHP2 mutant (tetO-SHP2(E76K)) and analyzed the role of SHP2(E76K) in lung tumorigenesis in the Clara cell secretory protein (CCSP)-reverse tetracycline transactivator (rtTA)/tetO-SHP2(E76K) bitransgenic mice. SHP2(E76K) activated Erk1/Erk2 (Erk1/2) and Src, and upregulated c-Myc and Mdm2 in the lungs of bitransgenic mice. Atypical adenomatous hyperplasia and small adenomas were observed in CCSP-rtTA/tetO-SHP2(E76K) bitransgenic mice induced with Dox for 2-6 months and progressed to larger adenoma and adenocarcinoma by 9 months. Dox withdrawal from bitransgenic mice bearing magnetic resonance imaging-detectable lung tumors resulted in tumor regression. These results show that the activating SHP2 mutant promotes lung tumorigenesis and that the SHP2 mutant is required for tumor maintenance in this mouse model of non-small cell lung cancer. SHP2(E76K) was associated with Gab1 in the lung of transgenic mice. Elevated pGab1 was observed in the lung of Dox-induced CCSP-rtTA/tetO-SHP2(E76K) mice and in cell lines expressing SHP2(E76K), indicating that the activating SHP2 mutant autoregulates tyrosine phosphorylation of its own docking protein. Gab1 tyrosine phosphorylation is sensitive to inhibition by the Src inhibitor dasatinib in GOF SHP2-mutant-expressing cells, suggesting that Src family kinases are involved in SHP2 mutant-induced Gab1 tyrosine phosphorylation. ",10.1093/carcin/bgu025
PTPN11,E76K,"Activating mutations of PTPN11 (encoding the SHP2 phosphatase) are associated with Noonan syndrome, childhood leukemias, and sporadic solid tumors. Virtual screening combined with experimental assays was performed to identify inhibitors of SHP2 from a database of natural products. This effort led to the identification of cryptotanshinone as an inhibitor of SHP2. Cryptotanshinone inhibited SHP2 with an IC50 of 22.50 μM. Fluorescence titration experiments confirmed that it directly bound to SHP2. Enzymatic kinetic analyses showed that cryptotanshinone was a mixed-type and irreversible inhibitor. This drug was further verified for its ability to block SHP2-mediated cell signaling and cellular functions. Furthermore, mouse myeloid progenitors and patient leukemic cells with the activating mutation E76K in PTPN11 were found to be sensitive to this inhibitor. Since cryptotanshinone is used to treat cardiovascular diseases in Asian countries, this drug has a potential to be used directly or to be further developed to treat PTPN11-associated malignancies. ",10.1021/jm400474r
PTPN11,E76K,"Activating mutations in Ptpn11 (Shp2), a protein tyrosine phosphatase involved in diverse cell signaling pathways, are associated with pediatric leukemias and solid tumors. However, the pathogenic effects of these mutations have not been fully characterized. Here, we report that induction of the Ptpn11(E76K/+) mutation, the most common and active Ptpn11 mutation found in leukemias and solid tumors, in primary mouse embryonic fibroblasts resulted in proliferative arrest and premature senescence. As a result, apoptosis was markedly increased. These cellular responses were accompanied and mediated by up-regulation of p53 and p21. Moreover, intracellular levels of reactive oxygen species (ROS), byproducts of mitochondrial oxidative phosphorylation, were elevated in Ptpn11(E76K/+) cells. Since Shp2 is also distributed to the mitochondria (in addition to the cytosol), the impact of the Ptpn11(E76K/+) mutation on mitochondrial function was analyzed. These analyses revealed that oxygen consumption of Ptpn11(E76K/+) cells and the respiratory function of Ptpn11(E76K/+) mitochondria were significantly increased. Furthermore, we found that phosphorylation of mitochondrial Stat3, one of the substrates of Shp2 phosphatase, was greatly decreased in the mutant cells with the activating mutation Ptpn11(E76K/+). This study provides novel insights into the initial effects of tumor-associated Ptpn11 mutations. ",10.1074/jbc.M113.462291
