,gen,var,Abs,doi
PTPN11,T42A,"Noonan syndrome (NS) is a relatively rare inherited disease. Typical clinical presentation is important for the diagnosis of NS. But the initial presentation of NS could be significant variant individually which results in the difficult of working diagnosis. Here we report a rare neonatal case of NS who presented with refractory thrombocytopenia as the initial manifestation.
This was a preterm infant with refractory thrombocytopenia of unknown origin transferred from obstetric hospital at 6 weeks of age. During hospitalization, typical phenotypes of NS in addition to thrombocytopenia were observed, such as typical facial characteristics, short stature, atrial septal defect, cryptochidism, coagulation defect and chylothorax. Genetic testing showed a pathogenic variant at exon 2 of the PTPN11 gene with c.124A > G (p.T42A). Respiratory distress was deteriorated with progressive chylothorax. Chest tube was inserted for continuous draining. Chemical pleurodesis with erythromycin was tried twice, but barely effective. Finally, parents decided to withdraw medical care and the patient died.
Thrombocytopenia could be the first symptom of Noonan syndrome. After ruling out other common causes of thrombocytopenia, NS should be considered as the working diagnosis.",10.1186/s12887-021-02909-4
PTPN11,T42A,"SHP2/PTPN11 is a key regulator of cytokine, growth factor and integrin signaling. SHP2 influences cell survival, proliferation and differentiation by regulating major signaling pathways. Mutations in PTPN11 cause severe diseases like Noonan, LEOPARD syndrome or leukemia. Whereas several of these mutations result in altered enzymatic activity due to impaired auto-inhibition, not all disease patterns can be explained by this mechanism. In this study we analyzed altered binding properties of disease-related SHP2-mutants bearing point mutations within the SH2-domain (T42A, E139D, and R138Q). Mutants were chosen according to SPR assays, which revealed different binding properties of mutated SH2 towards phosphorylated receptor peptides. To analyze global changes in mutant binding properties we applied quantitative mass spectrometry (SILAC). Using an in vitro approach we identified overall more than 1000 protein candidates, which specifically bind to the SH2-domain of SHP2. We discovered that mutations in the SH2-domain selectively affected protein enrichment by altering the binding capacity of the SH2-domain. Mutation-dependent, enhanced or reduced exposure of SHP2 to its binding partners could have an impact on the dynamics of signaling networks. Thus, disease-associated mutants of SHP2 should not only be discussed in the context of deregulated auto-inhibition but also with respect to deregulated protein targeting of the SHP2 mutants.
Using quantitative mass spectrometry based proteomics we provided evidence that disease related mutations in SHP2 domains of SHP2 are able to influence SHP2 recruitment to its targets in mutation dependent manner. We discovered that mutations in the SH2-domain selectively affected protein enrichment ratios suggesting altered binding properties of the SH2-domain. We demonstrated that mutations within SHP2, which had been attributed to affect the enzymatic activity (i.e. affect the open/close status of SHP2), also differ in respect to binding properties. Our study indicates that SHP2 mutations need to be discussed not only in terms of deregulated auto-inhibition but also with respect to deregulated protein targeting properties of the SHP2 mutants. Discovery of the new binding partners for disease-related SHP2 mutants might provide a fruitful foundation for developing strategies targeting Noonan-associated leukemia.",10.1016/j.jprot.2013.04.005
PTPN11,T42A,"Congenital heart defects affect 60-85% of patients with RASopathies. We analysed the clinical and molecular characteristics of atrioventricular canal defect in patients with mutations affecting genes coding for proteins with role in the RAS/MAPK pathway. Between 2002 and 2011, 101 patients with cardiac defect and a molecularly confirmed RASopathy were collected. Congenital heart defects within the spectrum of complete or partial (including cleft mitral valve) atrioventricular canal defect were diagnosed in 8/101 (8%) patients, including seven with a PTPN11 gene mutation, and one single subject with a RAF1 gene mutation. The only recurrent mutation was the missense PTPN11 c.124 A>G change (T42A) in PTPN11. Partial atrioventricular canal defect was found in six cases, complete in one, cleft mitral valve in one. In four subjects the defect was associated with other cardiac defects, including subvalvular aortic stenosis, mitral valve anomaly, pulmonary valve stenosis and hypertrophic cardiomyopathy. Maternal segregation of PTPN11 and RAF1 gene mutations occurred in two and one patients, respectively. Congenital heart defects in the affected relatives were discordant in the families with PTPN11 mutations, and concordant in that with RAF1 mutation. In conclusion, our data confirm previous reports indicating that atrioventricular canal defect represents a relatively common feature in Noonan syndrome. Among RASopathies, atrioventricular canal defect was observed to occur with higher prevalence among subjects with PTPN11 mutations, even though this association was not significant possibly because of low statistical power. Familial segregation of atrioventricular canal defect should be considered in the genetic counselling of families with RASopathies.",10.1038/ejhg.2012.145
PTPN11,T42A,"Missense PTPN11 mutations cause Noonan and LEOPARD syndromes (NS and LS), two developmental disorders with pleiomorphic phenotypes. PTPN11 encodes SHP2, an SH2 domain-containing protein tyrosine phosphatase functioning as a signal transducer. Generally, different substitutions of a particular amino acid residue are observed in these diseases, indicating that the crucial factor is the residue being replaced. For a few codons, only one substitution is observed, suggesting the possibility of specific roles for the residue introduced. We analyzed the biochemical behavior and ligand-binding properties of all possible substitutions arising from single-base changes affecting codons 42, 139, 279, 282 and 468 to investigate the mechanisms underlying the invariant occurrence of the T42A, E139D and I282V substitutions in NS and the Y279C and T468M changes in LS. Our data demonstrate that the isoleucine-to-valine change at codon 282 is the only substitution at that position perturbing the stability of SHP2's closed conformation without impairing catalysis, while the threonine-to-alanine change at codon 42, but not other substitutions of that residue, promotes increased phosphopeptide-binding affinity. The recognition specificity of the C-SH2 domain bearing the E139D substitution differed substantially from its wild-type counterpart acquiring binding properties similar to those observed for the N-SH2 domain, revealing a novel mechanism of SHP2's functional dysregulation. Finally, while functional selection does not seem to occur for the substitutions at codons 279 and 468, we point to deamination of the methylated cytosine at nucleotide 1403 as the driving factor leading to the high prevalence of the T468M change in LS.",10.1093/hmg/ddn099
PTPN11,T42A,"PTPN11 missense mutations cause approximately 50% of Noonan syndrome, an autosomal dominant disorder presenting with various congenital heart defects, most commonly valvar pulmonary stenosis, and hypertrophic cardiomyopathy. Atrioventricular septal defects and coarctation of the aorta occur in 15% and 9%, respectively. The aim of this study was to determine if PTPN11 mutations exist in non-syndromic patients with these two relevant forms of congenital heart disease. The 15 coding PTPN11 exons and their intron boundaries from subjects with atrioventricular septal defects (n = 24) and coarctation of the aorta (n = 157) were analyzed using denaturing high performance liquid chromatography and sequenced if abnormal. One subject with an atrioventricular septal defect but no other known medical problems had a c.127C > T transition in exon 2, predicting a p.L43F substitution. This mutation affected the phosphotyrosine-binding region in the N-terminal src homology 2 domain and was close to a Noonan syndrome mutation (p.T42A). An otherwise healthy patient with aortic coarctation had a silent c.540C > T change in exon 5 corresponding to p.D180D. Our study showed that PTPN11 mutations are rarely found in two isolated forms of congenital heart disease that commonly occur in Noonan syndrome. The p.L43F mutation belongs to a rare class of PTPN11 mutations altering the phosphotyrosine-binding region. These mutations are not predicted to alter the autoinhibition of the PTPN11 protein product, SHP-2, which is the mechanism for the vast majority of mutations causing Noonan syndrome. Future studies will be directed towards understanding these rare phosphotyrosine binding region mutants.",10.1002/ajmg.a.30789
PTPN11,D61G,"To explore the synergistic effect and metabolic mechanism of chronic arsenic exposure and 
Arsenic-transformed 
Low-dose arsenic exposure promoted WT MEFs proliferation and exacerbated malignancy driven by 
This study found that metabolic reprogramming, particularly mitochondrial hyperactivation, is a core mechanism underlying tumorigenesis induced by the synergistic effect of ",
PTPN11,D61G,"Most commonly used behavioral measures for testing learning and memory in the Morris water maze (MWM) involve comparisons of an animal's residence time in different quadrants of the pool. Such measures are limited in their ability to test different aspects of the animal's performance. Here, we describe novel measures of performance in the MWM that use vector fields to capture the motion of mice as well as their search pattern in the maze. Using these vector fields, we develop quantitative measures of performance that are intuitive and more sensitive than classical measures. First, we describe search patterns in terms of vector field properties and use these properties to define three metrics of spatial memory namely Spatial Accuracy, Uncertainty and, Intensity of Search. We demonstrate the usefulness of these measures using four different data sets including comparisons between different strains of mice, an analysis of two mouse models of Noonan syndrome (NS; Ptpn11 D61G and Ptpn11 N308D/+), and a study of goal reversal training. Importantly, besides highlighting novel aspects of performance in this widely used spatial task, our measures were able to uncover previously undetected differences, including in an animal model of NS, which we rescued with the mitogen activated protein kinase kinase (MEK) inhibitor SL327. Thus, our results show that our approach breaks down performance in the MWM into sensitive measurable independent components that highlight differences in spatial learning and memory in the MWM that were undetected by conventional measures.",10.1002/hipo.23404
PTPN11,D61G,"Homeostatic scaling of the synapse, such as synaptic down-scaling, has been proposed to offset deleterious effects induced by sustained synaptic strength enhancement. Proper function and subcellular distribution of Src homology 2 domain-containing nonreceptor protein tyrosine phosphatase (SHP2) are required for synaptic plasticity. However, the role of SHP2 in synaptic down-scaling remains largely unknown. Here, using biochemical assays and cell-imaging techniques, we found that synaptic SHP2 levels are temporally regulated during synaptic down-scaling in cultured hippocampal neurons. Furthermore, we observed that a Noonan syndrome-associated mutation of SHP2, resulting in a D61G substitution, prevents synaptic down-scaling. We further show that this effect is due to an inability of the SHP2-D61G variant to properly disassociate from postsynaptic density protein 95, leading to impaired SHP2 dispersion from synaptic sites after synaptic down-scaling. Our findings reveal a molecular mechanism of the Noonan syndrome-associated genetic variant SHP2-D61G that contributes to deficient synaptic down-scaling.",10.1074/jbc.RA119.010331
PTPN11,D61G,"Mutations in RAS signaling pathway components cause diverse neurodevelopmental disorders, collectively called RASopathies. Previous studies have suggested that dysregulation in RAS-extracellular signal-regulated kinase (ERK) activation is restricted to distinct cell types in different RASopathies. Some cases of Noonan syndrome (NS) are associated with gain-of-function mutations in the phosphatase SHP2 (encoded by ",10.1126/scisignal.aau5755
PTPN11,D61G,"Noonan syndrome (NS) is a common autosomal dominant congenital disorder which could cause the congenital cardiopathy and cancer predisposition. Previous studies reported that the knock-in mouse models of the mutant D61G of SHP2 exhibited the major features of NS, which demonstrated that the mutation D61G of SHP2 could cause NS. To explore the effect of D61G mutation on SHP2 and explain the high activity of the mutant, molecular dynamic simulations were performed on wild type (WT) of SHP2 and the mutated SHP2-D61G, respectively. The principal component analysis and dynamic cross-correlation mapping, associated with secondary structure, showed that the D61G mutation affected the motions of two regions (residues Asn 58-Thr 59 and Val 460-His 462) in SHP2 from β to turn. Moreover, the residue interaction networks analysis, the hydrogen bond occupancy analysis and the binding free energies were calculated to gain detailed insight into the influence of the mutant D61G on the two regions, revealing that the major differences between SHP2-WT and SHP2-D61G were the different interactions between Gly 61 and Gly 462, Gly 61 and Ala 461, Gln 506 and Ile 463, Gly 61 and Asn 58, Ile 463 and Thr 466, Gly 462 and Cys 459. Consequently, our findings here may provide knowledge to understand the increased activity of SHP2 caused by the mutant D61G.",10.1080/07391102.2017.1402709
PTPN11,D61G,"Idiopathic pulmonary fibrosis (IPF) is a chronic fatal lung disease with dismal prognosis and no cure. The potential role of the ubiquitously expressed SH2 domain-containing tyrosine phosphatase-2 (SHP2) as a therapeutic target has not been studied in IPF.
To determine the expression, mechanistic role, and potential therapeutic usefulness of SHP2 in pulmonary fibrosis.
The effects of SHP2 overexpression and inhibition on fibroblast response to profibrotic stimuli were analyzed in vitro in primary human and mouse lung fibroblasts. In vivo therapeutic effects were assessed in the bleomycin model of lung fibrosis by SHP2-lentiviral administration and transgenic mice carrying a constitutively active SHP2 mutation.
SHP2 was down-regulated in lungs and lung fibroblasts obtained from patients with IPF. Immunolocalization studies revealed that SHP2 was absent within fibroblastic foci. Loss of SHP2 expression or activity was sufficient to induce fibroblast-to-myofibroblast differentiation in primary human lung fibroblasts. Overexpression of constitutively active SHP2 reduced the responsiveness of fibroblasts to profibrotic stimuli, including significant reductions in cell survival and myofibroblast differentiation. SHP2 effects were mediated through deactivation of fibrosis-relevant tyrosine kinase and serine/threonine kinase signaling pathways. Mice carrying the Noonan syndrome-associated gain-of-function SHP2 mutation (SHP2
Our data suggest that SHP2 is an important regulator of fibroblast differentiation, and its loss as observed in IPF facilitates profibrotic phenotypic changes. Augmentation of SHP2 activity or expression should be investigated as a novel therapeutic strategy for IPF.",10.1164/rccm.201602-0329OC
PTPN11,D61G,"Evidence suggests that Src homologous protein phosphotyrosyl phosphatase 2 (SHP2) mutations promote cancer development in several solid tumours. In this study, we focused on the in vivo and in vitro effects of an SHP2 mutation on the breast cancer phenotype to determine whether this mutation is correlated with a malignant phenotype.
Mutant PTPN11 cDNA (D61G) was transduced into MDA-MB231 and MCF-7 cells. The effects of the D61G mutation on tumourigenesis and malignant behaviours, such as cell adhesion, proliferation, migration and invasion, were examined. Potential underlying molecular mechanisms, i.e., activation of the Gab1-Ras-Erk axis, were also examined.
In vitro experiments revealed that tumour adhesion, proliferation, migration and invasion were significantly increased in the SHP2 D61G mutant groups. Consistently, in vivo experiments also showed that the tumour sizes and weights were increased significantly in the SHP2 D61G-MB231 group (p < 0.001) in association with tumour metastasis. Mechanistically, the PTPN11 mutation resulted in activation of the Ras-ErK pathway. The binding between Gab1 and mutant SHP2 was significantly increased.
Mutant SHP2 significantly promotes tumour migration and invasion at least partially through activation of the Gab1-Ras-Erk axis. This finding could have direct implications for breast cancer therapy.",10.18632/oncotarget.6561
PTPN11,D61G,"In Noonan syndrome (NS) 30-50% of subjects show cognitive deficits of unknown etiology and with no known treatment. Here, we report that knock-in mice expressing either of two NS-associated mutations in Ptpn11, which encodes the nonreceptor protein tyrosine phosphatase Shp2, show hippocampal-dependent impairments in spatial learning and deficits in hippocampal long-term potentiation (LTP). In addition, viral overexpression of an NS-associated allele PTPN11(D61G) in adult mouse hippocampus results in increased baseline excitatory synaptic function and deficits in LTP and spatial learning, which can be reversed by a mitogen-activated protein kinase kinase (MEK) inhibitor. Furthermore, brief treatment with lovastatin reduces activation of the GTPase Ras-extracellular signal-related kinase (Erk) pathway in the brain and normalizes deficits in LTP and learning in adult Ptpn11(D61G/+) mice. Our results demonstrate that increased basal Erk activity and corresponding baseline increases in excitatory synaptic function are responsible for the LTP impairments and, consequently, the learning deficits in mouse models of NS. These data also suggest that lovastatin or MEK inhibitors may be useful for treating the cognitive deficits in NS. ",10.1038/nn.3863
PTPN11,D61G,"Gain of function (GOF) mutations in protein tyrosine phosphatase Ptpn11 have been identified in childhood leukemias, and these mutations are sufficient to drive the development of myeloproliferative disorder and malignant leukemias in mice. However, the molecular mechanisms by which Ptpn11 mutations induce these malignancies are not completely understood. Here we report that Ptpn11 GOF mutations cause cytokine hypersensitivity in hematopoietic cells partly by enhancing the production of reactive oxygen species (ROS). GOF mutations D61G or E76K in Ptpn11 increased ROS levels in myeloid progenitors but not in hematopoietic stem cells. Increased ROS enhanced cellular responses to cytokines by promoting cytokine signaling. Treatment with an antioxidant partially corrected cytokine hypersensitivity in Ptpn11 mutant progenitors. Further analyses demonstrated that Ptpn11 mutations increased mitochondrial aerobic metabolism by interacting with a novel substrate in the mitochondria. This study provides new insights into the pathogenic effects of GOF mutations of Ptpn11 and implies that antioxidants may have a therapeutic benefit for the leukemic patients with these mutations.",10.1371/journal.pone.0063152
PTPN11,D61G,"Noonan syndrome (NS), a genetic disease caused in half of cases by activating mutations of the tyrosine phosphatase SHP2 (PTPN11), is characterized by congenital cardiopathies, facial dysmorphic features, and short stature. How mutated SHP2 induces growth retardation remains poorly understood. We report here that early postnatal growth delay is associated with low levels of insulin-like growth factor 1 (IGF-1) in a mouse model of NS expressing the D61G mutant of SHP2. Conversely, inhibition of SHP2 expression in growth hormone (GH)-responsive cell lines results in increased IGF-1 release upon GH stimulation. SHP2-deficient cells display decreased ERK1/2 phosphorylation and rat sarcoma (RAS) activation in response to GH, whereas expression of NS-associated SHP2 mutants results in ERK1/2 hyperactivation in vitro and in vivo. RAS/ERK1/2 inhibition in SHP2-deficient cells correlates with impaired dephosphorylation of the adaptor Grb2-associated binder-1 (GAB1) on its RAS GTPase-activating protein (RASGAP) binding sites and is rescued by interfering with RASGAP recruitment or function. We demonstrate that inhibition of ERK1/2 activation results in an increase of IGF-1 levels in vitro and in vivo, which is associated with significant growth improvement in NS mice. In conclusion, NS-causing SHP2 mutants inhibit GH-induced IGF-1 release through RAS/ERK1/2 hyperactivation, a mechanism that could contribute to growth retardation. This finding suggests that, in addition to its previously shown beneficial effect on NS-linked cardiac and craniofacial defects, RAS/ERK1/2 modulation could also alleviate the short stature phenotype in NS caused by PTPN11 mutations.",10.1073/pnas.1119803109
PTPN11,D61G,"Germline and somatic gain-of-function mutations in tyrosine phosphatase PTPN11 (SHP-2) are associated with juvenile myelomonocytic leukemia (JMML), a myeloproliferative disease (MPD) of early childhood. The mechanism by which PTPN11 mutations induce this disease is not fully understood. Signaling partners that mediate the pathogenic effects of PTPN11 mutations have not been explored. Here we report that germ line mutation Ptpn11(D61G) in mice aberrantly accelerates hematopoietic stem cell (HSC) cycling, increases the stem cell pool, and elevates short-term and long-term repopulating capabilities, leading to the development of MPD. MPD is reproduced in primary and secondary recipient mice transplanted with Ptpn11(D61G/+) whole bone marrow cells or purified Lineage(-)Sca-1(+)c-Kit(+) cells, but not lineage committed progenitors. The deleterious effects of Ptpn11(D61G) mutation on HSCs are attributable to enhancing cytokine/growth factor signaling. The aberrant HSC activities caused by Ptpn11(D61G) mutation are largely corrected by deletion of Gab2, a prominent interacting protein and target of Shp-2 in cell signaling. As a result, MPD phenotypes are markedly ameliorated in Ptpn11(D61G/+)/Gab2(-/-) double mutant mice. Collectively, our data suggest that oncogenic Ptpn11 induces MPD by aberrant activation of HSCs. This study also identifies Gab2 as an important mediator for the pathogenic effects of Ptpn11 mutations.",10.1182/blood-2010-01-265652
PTPN11,D61G,"Noonan syndrome (NS) is an autosomal dominant disorder, and a main feature is congenital heart malformation. About 50% of cases are caused by gain-of-function mutations in the tyrosine phosphatase SHP2/PTPN11, a downstream regulator of ERK/MAPK. Recently it was reported that SHP2 also localizes to the mitochondrial intercristae/intermembrane space (IMS), but the role of SHP2 in mitochondria is unclear. The mitochondrial oxidative phosphorylation (OxPhos) system provides the vast majority of cellular energy and produces reactive oxygen species (ROS). Changes in ROS may interfere with organ development such as that observed in NS patients. Several phosphorylation sites have been found in OxPhos components including cytochrome c oxidase (CcO) and cytochrome c (Cytc), and we hypothesized that OxPhos complexes may be direct or indirect targets of SHP2. We analyzed mitochondrial function using mouse fibroblasts from wild-types, SHP2 knockdowns, and D61G SHP2 mutants leading to constitutively active SHP2, as found in NS patients. Levels of OxPhos complexes were similar except for CcO and Cytc, which were 37% and 28% reduced in the D61G cells. However, CcO activity was significantly increased, as we also found for two lymphoblast cell lines from NS patients with two independent mutations in PTPN11. D61G cells showed lower mitochondrial membrane potential and 30% lower ATP content compared to controls. ROS were significantly increased; aconitase activity, a marker for ROS-induced damage, was decreased; and catalase activity was increased in D61G cells. We propose that decreased energy levels and/or increased ROS may explain, at least in part, some of the clinical features in NS that overlap with children with mitochondrial disorders.",10.1016/j.bbadis.2009.10.005
