,gen,var,Abs,doi
PTPN11,Y279C,"Noonan syndrome with multiple lentigines (NSML), formerly known as LEOPARD syndrome (LS), is an autosomal dominant inherited multisystemic disorder. Most patients involve mutation in SHP2 encoded by tyrosine-protein phosphatase non-receptor type 11 (PTPN11) gene. Studies have shown that NSML-associated Y279C mutation exhibited the reduced phosphatase activity, leading to loss-of-function (LOF) of SHP2. However, the effect of the Y279C mutation on the SHP2 at the molecular level is unclear. In this study, molecular dynamics simulations of SHP2 wild-type (SHP2",10.1080/07391102.2019.1634641
PTPN11,Y279C,Catalytically activating mutations in ,10.1126/scisignal.aao1591
PTPN11,Y279C,"Noonan Syndrome with Multiple Lentigines (NSML, formerly LEOPARD syndrome) is an autosomal dominant ""RASopathy"" disorder manifesting in congenital heart disease. Most cases of NSML are caused by catalytically inactivating mutations in the protein tyrosine phosphatase (PTP), non-receptor type 11 (PTPN11), encoding the SH2 domain-containing PTP-2 (SHP2) protein. We previously generated knock-in mice harboring the PTPN11 mutation Y279C, one of the most common NSML alleles; these now-termed SHP2Y279C/+ mice recapitulate the human disorder and develop hypertrophic cardiomyopathy (HCM) by 12 weeks of age. Functionally, heart and/or cardiomyocyte lysates from SHP2Y279C/+ mice exhibit increased basal and agonist-induced AKT and mTOR activities. Here, we sought to determine whether we could reverse the hypertrophy in SHP2Y279C/+ mice using ARQ 092, an oral and selective allosteric AKT inhibitor currently in clinical trials for patients with PI3K/AKT-driven tumors or Proteus syndrome. We obtained echocardiographs of SHP2Y279C/+ and wildtype (SHP2+/+) littermates, either in the presence or absence of ARQ 092 at 12, 14, and 16 weeks of age. While SHP2Y279C/+ mice developed significant left ventricular hypertrophy by 12 weeks, as indicated by decreased chamber dimension and increased posterior wall thickness, treatment of SHP2Y279C/+ mice with ARQ 092 normalized the hypertrophy in as early as 2 weeks following treatment, with hearts comparable in size to those in wildtype (SHP2+/+) mice. In addition, we observed an increase in fractional shortening (FS%) in SHP2Y279C/+ mice, an effect of increased compensatory hypertrophy, which was not apparent in SHP2Y279C/+ mice treated with ARQ 092, suggesting functional improvement of HCM upon treatment with the AKT inhibitor. Finally, we found that ARQ 092 specifically inhibited AKT activity, as well as its downstream effectors, PRAS and S6RP in NSML mice. Taken together, these data suggest ARQ 092 may be a promising novel therapy for treatment of hypertrophy in NSML patients.",10.1371/journal.pone.0178905
PTPN11,Y279C,"To evaluate the spectrum of PTPN11 gene mutations in Noonan syndrome patients and to study the genotype-phenotype associations.
In this study, twenty Noonan syndrome patients with PTPN11 mutations were included. The patients underwent a detailed clinical and physical evaluation. To identify inherited cases, parents of all mutation positive patients were analyzed.
Thirteen different PTPN11 mutations, two of them being novel, were detected in the study group. These mutations included eleven missense mutations: p.G60A, p.D61N, p.Y62D, p.Y63C, p.E69Q, p.Q79R, p.Y279C,p.N308D, p.N308S, p.M504V, p.Q510R and two novel missense mutations: p.I56V and p.I282M. The frequency of cardiac abnormalities and short stature were found to be 80 % and 80 %, respectively. Mental retardation was not observed in patients having exon 8 mutations. No significant correlations were detected between other phenotypic features and genotypes.
By identifying genotype-phenotype correlations, this study provides information on phenotypes observed in NS patients with different PTPN11 mutations.",10.1007/s12098-015-1998-6
PTPN11,Y279C,"SHP2, encoded by the PTPN11 gene, is a protein tyrosine phosphatase that plays a key role in the proliferation of cells via RAS-ERK activation. SHP2 also promotes Wnt signaling by dephosphorylating parafibromin. Germline missense mutations of PTPN11 are found in more than half of patients with Noonan syndrome (NS) and LEOPARD syndrome (LS), both of which are congenital developmental disorders with multiple common symptoms. However, whereas NS-associated PTPN11 mutations give rise to gain-of-function SHP2 mutants, LS-associated SHP2 mutants are reportedly loss-of-function mutants. To determine the phosphatase activity of LS-associated SHP2 more appropriately, we performed an in vitro phosphatase assay using tyrosine-phosphorylated parafibromin, a biologically relevant substrate of SHP2 and the positive regulator of Wnt signaling that is activated through SHP2-mediated dephosphorylation. We found that LS-associated SHP2 mutants (Y279C, T468M, Q506P, and Q510E) exhibited a substantially reduced phosphatase activity toward parafibromin when compared with wild-type SHP2. Furthermore, each of the LS-associated mutants displayed a differential degree of decrease in phosphatase activity. Deviation of the SHP2 catalytic activity from a certain range, either too strong or too weak, may therefore lead to similar clinical outcomes in NS and LS, possibly through an imbalanced Wnt signal caused by inadequate dephosphorylation of parafibromin.",10.1016/j.bbrc.2015.12.117
PTPN11,Y279C,"LEOPARD syndrome (LS, OMIM 151100) is a rare monogenic disorder. The name is an acronym of its major features such as multiple lentigines, electrocardiographic conduction defects, ocular hypertelorism, pulmonary stenosis, abnormalities of genitalia, retardation of growth and sensorineural deafness. LS develops due to mutations in the protein-tyrosine phosphatase nonreceptor-type 11, PTPN11. Here, we have investigated a 51-year-old Hungarian male patient affected by LS. Direct sequencing of the PTPN11 gene revealed a worldwide recurrent missense mutation (c.836A/G; p.Tyr279Cys), which has been previously identified in 47 LS patients. Comparison of the clinical phenotypes of our patient and the ones reported in the literature demonstrates great phenotypic diversity despite the same genotype. ",10.1007/s00403-015-1597-4
PTPN11,Y279C,"LEOPARD syndrome (LS) is an autosomal dominant condition with multiple anomalies, including multiple lentigines. LS is caused by mutations in PTPN11, encoding the protein tyrosine phosphatase, SHP-2. We report here 2 unrelated Japanese cases of LS with different PTPN11 mutations (p.Y279C and p.T468P). To elucidate the pathogenesis of multiple lentigines in LS, ultrastructural and immunohistochemical analyses of lentigines and non-lesional skin were performed. Numerous mature giant melanosomes in melanocytes and keratinocytes were observed in lentigines. In addition, the levels of expression of endothelin-1 (ET-1), phosphorylated Akt, mTOR and STAT3 in the epidermis in lentigines were significantly elevated compared with non-lesional skin. In in vitro assays, melanin synthesis in human melanoma cells expressing SHP-2 with LS-associated mutations was higher than in cells expressing normal SHP-2, suggesting that LS-associated SHP-2 mutations might enhance melanin synthesis in melanocytes, and that the activation of Akt/mTOR signalling may contribute to this process. ",10.2340/00015555-2123
PTPN11,Y279C,"This is the first reported family with Leopard syndrome (LS) from Bosnia and Herzegovina. We report five cases of LS from two generations of the same family. In the present series of patients from one family, all patients carry the same recurrent mutation Y279C in the PTPN11 gene, exhibiting different phenotypes and a variable expression of multiple lentigines. The diagnosis may be on clinical basis as the diagnostic clues of LS are: multiple lentigines and cafè-au-lait-spots, short stature, distinctive face, congenital heart disease, conduction abnormalities, abnormal genitalia, and sensorineural deafness.
the clinical diagnosis of LS should be molecularly confirmed in the patient.",10.1007/s00431-013-2243-9
PTPN11,Y279C,"The RAS/MAPK pathway proteins with germline mutations in their respective genes are associated with some disorders such as Noonan, LEOPARD (LS), neurofibromatosis type 1, Costello and cardio-facio-cutaneous syndromes. LEOPARD is an acronym, mnemonic for the major manifestations of this disorder, characterized by multiple lentigines, electrocardiographic abnormalities, ocular hypertelorism, pulmonic stenosis, abnormal genitalia, retardation of growth, and sensorineural deafness. Though it is not included in the acronym, hypertrophic cardiomyopathy is the most frequent cardiac anomaly observed, representing a potentially life-threatening problem in these patients. PTPN11, RAF1 and BRAF are the genes known to be associated with LS, identifying molecular genetic testing of the 3 gene mutations in about 95% of affected individuals. PTPN11 mutations are the most frequently found. Eleven different missense PTPN11 mutations (Tyr279Cys/Ser, Ala461Thr, Gly464Ala, Thr468Met/Pro, Arg498Trp/Leu, Gln506Pro, and Gln510Glu/Pro) have been reported so far in LS, 2 of which (Tyr279Cys and Thr468Met) occur in about 65% of the cases. Here, we provide an overview of clinical aspects of this disorder, the molecular mechanisms underlying pathogenesis and major genotype-phenotype correlations.",10.1159/000342251
PTPN11,Y279C,"LEOPARD syndrome (LS) is an acronym consisting of lentigines, electrocardiographic abnormalities, ocular hypertelorism, pulmonary valve stenosis, abnormal genitalia, retardation of growth and deafness. However, hypertrophic cardiomyopathy, the most frequent cause of sudden cardiac death in young people, is the most common cardiovascular manifestation in LS patients and the major determinant of mortality and morbidity. In approximately 85% of the patients with a definite diagnosis of LS, a missense mutation is found in the protein-tyrosine phosphatase non-receptor type 11 (PTPN11) gene located on chromosome 12q24.1. We report the case of an asymptomatic 17-year-old male with a missense mutation (c.836A>G) in exon 7 (Tyr279Cys) of the PTPN11 gene and a non-obstructive asymmetric anteroseptal hypertrophic cardiomyopathy.",10.1159/000335995
PTPN11,Y279C,"LEOPARD syndrome (LS) is an autosomal dominant ""RASopathy"" that manifests with congenital heart disease. Nearly all cases of LS are caused by catalytically inactivating mutations in the protein tyrosine phosphatase (PTP), non-receptor type 11 (PTPN11) gene that encodes the SH2 domain-containing PTP-2 (SHP2). RASopathies typically affect components of the RAS/MAPK pathway, yet it remains unclear how PTPN11 mutations alter cellular signaling to produce LS phenotypes. We therefore generated knockin mice harboring the Ptpn11 mutation Y279C, one of the most common LS alleles. Ptpn11(Y279C/+) (LS/+) mice recapitulated the human disorder, with short stature, craniofacial dysmorphia, and morphologic, histologic, echocardiographic, and molecular evidence of hypertrophic cardiomyopathy (HCM). Heart and/or cardiomyocyte lysates from LS/+ mice showed enhanced binding of Shp2 to Irs1, decreased Shp2 catalytic activity, and abrogated agonist-evoked Erk/Mapk signaling. LS/+ mice also exhibited increased basal and agonist-induced Akt and mTor activity. The cardiac defects in LS/+ mice were completely reversed by treatment with rapamycin, an inhibitor of mTOR. Our results demonstrate that LS mutations have dominant-negative effects in vivo, identify enhanced mTOR activity as critical for causing LS-associated HCM, and suggest that TOR inhibitors be considered for treatment of HCM in LS patients.",10.1172/JCI44972
PTPN11,Y279C,"LEOPARD syndrome (LS) is a heterogeneous disease characterised mainly by cutaneous manifestations. LEOPARD is the acronym for its major features-multiple lentigines, electrocardiographic conduction defects, ocular hypertelorism, pulmonary stenosis, abnormalities of (male) genitalia, retardation of growth and sensorineural deafness. As clinical manifestations are variable, molecular testing is supportive in the diagnosis of LS. We describe two unrelated LS cases with a common PTPN11 mutation Y279C and with completely different clinical features including distinct changes in skin pigmentation. In patient 1, the first complaint was hyperactive behaviour. First lentigines were presented at birth, but intensive growth began at the age of 2-4 years. Multiple dark lentigines were located mainly on the face and the upper part of the trunk, but the oral mucosa was spared. Patient 2 was born from induced labour due to polyhydramnion, and in the second week of life, mitral valve insufficiency and hypertrophic cardiomyopathy were diagnosed. Rapid growth of lentigines began at the age of 3 years. These are mostly located in the joint areas in the lower extremities; the face and upper trunk are spared from lentigines. In both cases, the rapid growth of lentigines made it possible to shift the diagnosis towards LS. Clinicians should give more consideration to rare genetic syndromes, especially in the case of symptoms from different clinical areas.",10.1007/s00431-009-1058-1
PTPN11,Y279C,"Here we report on a patient with multiple lentigines, hypertelorism, short stature, arachnodactyly, scoliosis, dissecting aneurysm, hypertrophic cardiomyopathy and developmental delay, and a family history of Marfan syndrome. The patient is affected with both Marfan and LEOPARD syndromes. Mutational screening of the FBN1 gene showed a c.1464T>A (p.C488X) mutation and screening of the PTPN11 gene showed a c.836A>G (p.Y279C) mutation. We conclude that each mutation contributed independently to individual features in the ocular and cardiovascular systems, although short stature was more significantly influenced by the p.Y279C change in PTPN11 rather than the mutation in FBN1. To our knowledge, this is the first report of mutations in both FBN1 and PTPN11 with combined phenotypes of Marfan and LEOPARD syndromes.",10.1002/ajmg.a.32735
PTPN11,Y279C,"Missense mutations in the PTPN11 gene, which encodes the protein tyrosine phosphatase SHP-2, cause clinically similar but distinctive disorders, LEOPARD (LS) and Noonan (NS) syndromes. The LS is an autosomal dominant disorder with pleomorphic developmental abnormalities including lentigines, cardiac defects, short stature and deafness. Biochemical analyses indicated that LS alleles engender loss-of-function (LOF) effects, while NS mutations result in gain-of-function (GOF). These biochemical findings lead to an enigma that how PTPN11 mutations with opposite effects on function result in disorders that are so similar. To study the developmental effects of the commonest LS PTPN11 alleles (Y279C and T468M), we generated LS transgenic fruitflies using corkscrew (csw), the Drosophila orthologue of PTPN11. Ubiquitous expression of the LS csw mutant alleles resulted in ectopic wing veins and, for the Y279C allele, rough eyes with increased R7 photoreceptor numbers. These were GOF phenotypes mediated by increased RAS/MAPK signaling and requiring the LS mutant's residual phosphatase activity. Our findings provide the first evidence that LS mutant alleles have GOF developmental effects despite reduced phosphatase activity, providing a rationale for how PTPN11 mutations with GOF and LOF produce similar but distinctive syndromes.",10.1093/hmg/ddn336
PTPN11,Y279C,"Missense PTPN11 mutations cause Noonan and LEOPARD syndromes (NS and LS), two developmental disorders with pleiomorphic phenotypes. PTPN11 encodes SHP2, an SH2 domain-containing protein tyrosine phosphatase functioning as a signal transducer. Generally, different substitutions of a particular amino acid residue are observed in these diseases, indicating that the crucial factor is the residue being replaced. For a few codons, only one substitution is observed, suggesting the possibility of specific roles for the residue introduced. We analyzed the biochemical behavior and ligand-binding properties of all possible substitutions arising from single-base changes affecting codons 42, 139, 279, 282 and 468 to investigate the mechanisms underlying the invariant occurrence of the T42A, E139D and I282V substitutions in NS and the Y279C and T468M changes in LS. Our data demonstrate that the isoleucine-to-valine change at codon 282 is the only substitution at that position perturbing the stability of SHP2's closed conformation without impairing catalysis, while the threonine-to-alanine change at codon 42, but not other substitutions of that residue, promotes increased phosphopeptide-binding affinity. The recognition specificity of the C-SH2 domain bearing the E139D substitution differed substantially from its wild-type counterpart acquiring binding properties similar to those observed for the N-SH2 domain, revealing a novel mechanism of SHP2's functional dysregulation. Finally, while functional selection does not seem to occur for the substitutions at codons 279 and 468, we point to deamination of the methylated cytosine at nucleotide 1403 as the driving factor leading to the high prevalence of the T468M change in LS.",10.1093/hmg/ddn099
PTPN11,Y279C,"The LEOPARD syndrome is a complex of multisystemic congenital abnormalities characterized by lentiginosis, electrocardiographic conduction abnormalities, ocular hypertelorism, pulmonary stenosis, abnormalities of genitalia, retardation of growth, and deafness (sensorineural). Mutations in PTPN11, a gene encoding the protein tyrosine phosphatase SHP-2 located on chromosome 12q24.1, have been identified in 88% of patients with LEOPARD syndrome. A missense mutation (836-->G; Tyr279Cys) in exon 7 of PTPN11 gene was identified in this patient and his mother with LEOPARD syndrome. This mutation is one of the two recurrent mutations most often associated with the syndrome. Leukemia has not previously been reported in patients with LEOPARD syndrome. The authors describe a 13-year-old boy diagnosed with both LEOPARD syndrome and acute myelomonocytic leukemia (AML-M4).",10.1097/01.mph.0000199590.21797.0b
PTPN11,Y279C,"Germline mutations in PTPN11, the gene encoding the protein tyrosine phosphatase SHP-2, cause Noonan syndrome (NS) and the clinically related LEOPARD syndrome (LS), whereas somatic mutations in the same gene contribute to leukemogenesis. On the basis of our previously gathered genetic and biochemical data, we proposed a model that splits NS- and leukemia-associated PTPN11 mutations into two major classes of activating lesions with differential perturbing effects on development and hematopoiesis. To test this model, we investigated further the diversity of germline and somatic PTPN11 mutations, delineated the association of those mutations with disease, characterized biochemically a panel of mutant SHP-2 proteins recurring in NS, LS, and leukemia, and performed molecular dynamics simulations to determine the structural effects of selected mutations. Our results document a strict correlation between the identity of the lesion and disease and demonstrate that NS-causative mutations have less potency for promoting SHP-2 gain of function than do leukemia-associated ones. Furthermore, we show that the recurrent LS-causing Y279C and T468M amino acid substitutions engender loss of SHP-2 catalytic activity, identifying a previously unrecognized behavior for this class of missense PTPN11 mutations.",10.1086/499925
PTPN11,Y279C,"The multiple lentigines/LEOPARD syndrome (ML/LS) is a rare and complex genetic syndrome. It is an autosomal dominant disorder with a variable expressivity. The syndrome is mainly characterised by growth retardation, multiple lentigines, and congenital heart diseases with electrocardiographic anomalies, dysmorphia of the face and deafness. The incidence of this pathology is still unknown and a familial inheritance is present in 70% of cases. Some of the ML/LS clinical features are the same as those of the Noonan syndrome (NS), such as congenital cardiac abnormalities, dysmorphia and growth retardation. NS and ML/LS are caused by allele mutations of the PTPN11 gene. We report the case of a 3-year-old girl, who was observed for the presence of widespread lentigines, a 1/6-protosystolic murmur at the mesocardium and growth retardation. The diagnosis of ML/LS was made and thus a molecular analysis of the PTPN11 gene was carried out, directly sequencing the codifying region. The molecular analysis revealed a missense mutation (A836G) in hexone 7 (TYR279CYS) of the PTPNII gene. This mutation is has been observed, at present, in a few cases of ML/LS and Noonan syndrome.",
PTPN11,Y279C,"Nonsyndromic hypertrophic cardiomyopathy (HCM) is a primary cardiac disease transmitted as an autosomal dominant trait. Multiple chromosomal loci have been found to be involved in the etiology of this defect. LEOPARD syndrome is a genetic condition characteristically associated with HCM. Additional features of the syndrome include multiple lentigines, facial anomalies, sensorineural deafness, and growth retardation. Mutations in PTPN11, a gene encoding the protein tyrosine phosphatase SHP-2 located at chromosome 12q24, have been identified in patients with LEOPARD syndrome.
We report here on a patient with HCM presenting with classic clinical features of LEOPARD syndrome, whose father also has HCM, but lacks phenotypic anomalies of the syndrome. Molecular analysis searching for PTPN11 mutations was performed in this family. A missense mutation (836A-->G; Tyr279Cys) in exon 7 of PTPN11 gene was identified in the patient with LEOPARD syndrome, whereas no mutation in PTPN11 gene was detected in the father or in additional family members.
Aggregation of syndromic and nonsyndromic HCM in the same family is an unusual pattern of recurrence. Although genetic heterogeneity of LEOPARD and nonsyndromic HCM is not disputed, the existence of peculiar interactions linking genes causing nonsyndromic HCM and HCM in LEOPARD syndrome can be hypothesized. Different genes can work together, and a more severe cardiac phenotype can be due to additive effects. The involvement of familial susceptibility to specific cardiac malformations based on the presence of common predisposing factors can also be considered. Further molecular studies may shed light on these observations.",10.1002/bdra.10148
PTPN11,Y279C,"PTPN11 gene mutations are common to both patients with Noonan (NS) and LEOPARD syndrome (LS). So far only two recurrent mutations have been identified in LS patients by different research groups, i.e., Tyr279Cys and Thr468Met. In this work we describe the third PTPN11 mutation that has been found in a single LS patient. The mutation (c.1517A>C) substitutes a proline for a glutamine at amino acid 506 (Gln506Pro) in the phosphatase domain (PTP) of the PTPN11 peptide SHP2. This region is a mutation hotspot. Changes at amino acids 501 to 504 cause NS. Gln506Pro is predicted, by modeling analysis, to seriously disrupt the normal contacts between the regulating N-SH2 and the active PTP domains, leading to hyperactivity of the phosphatase. This report demonstrates that rarer mutations other than Tyr279Cys and Thr468Met can be found in LS patients and the need of screening the whole gene in those negative for the commonest mutations.",10.1002/humu.9149
PTPN11,Y279C,"LEOPARD syndrome (MIM #151100) is a rare autosomal dominant condition with characteristic skin anomalies, facial dysmorphism, hypertelorism, cardiac anomalies, and occasional conductive hearing loss. Mutations in the PTPN11 gene are described as the causal gene defect for the clinical features of Noonan syndrome (MIM #163950), but also for LEOPARD syndrome. For confirmation of the clinical diagnosis of multiple lentigines syndrome, the molecular genetic mutation analysis in the PTPN11 gene could be helpful.
We report on a family with LEOPARD syndrome in which the mutation analysis in the father and his daughter in the PTPN11 gene was carried out us:ng PCR, DHPLC, and automated sequencing.
We could identify both father and daughter as carriers of the mutation Y279C in the PTPN11 gene, which is known as a disease-related mutation.
The allelic affinity to Noonan syndrome could thus be further supported.",10.1007/s00105-003-0640-0
PTPN11,Y279C,"LEOPARD syndrome is an autosomal dominant disorder with multiple lentigines, congenital cardiac abnormalities, ocular hypertelorism, and retardation of growth. Deafness and genital abnormalities are less frequently found. We report a father and daughter and a third, unrelated patient with LEOPARD syndrome. Recently, missense mutations in the PTPN11 gene located in 12q24 were found to cause Noonan syndrome. All three cases of LEOPARD syndrome reported here have a Y279C mutation in the PTPN11 gene. We hypothesise that some PTPN11 mutations are associated with the typical Noonan syndrome phenotype and that other mutations, such as the Y279C mutation reported here, are associated with both the Noonan syndrome phenotype and with skin pigmentation anomalies, such as multiple lentigines or café au lait spots.",10.1136/jmg.39.8.571
