,gen,var,Abs,doi
PTPN11,N308D,"Noonan syndrome (NS) is an autosomal-dominant genetic disorder associated with highly variable features, including heart disease, short stature, minor facial anomalies and learning disabilities. Recent gene discoveries have laid the groundwork for exploring whether variability in the NS phenotype is related to differences at the genetic level. In this study, we examine the influence of both genotype and nongenotypic factors on cognitive functioning. Data are presented from 65 individuals with NS (ages 4-18) who were evaluated using standardized measures of intellectual functioning. The cohort included 33 individuals with PTPN11 mutations, 6 individuals with SOS1 mutations, 1 individual with a BRAF mutation and 25 participants with negative, incomplete or no genetic testing. Results indicate that genotype differences may account for some of the variation in cognitive ability in NS. Whereas cognitive impairments were common among individuals with PTPN11 mutations and those with unknown mutations, all of the individuals with SOS1 mutations exhibited verbal and nonverbal cognitive skills in the average range or higher. Participants with N308D and N308S mutations in PTPN11 also showed no (or mild) cognitive delays. Additional influences such as hearing loss, motor dexterity and parental education levels accounted for significant variability in cognitive outcomes. Severity of cardiac disease was not related to cognitive functioning. Our results suggest that some NS-causing mutations have a more marked impact on cognitive skills than others.",10.1111/j.1601-183X.2008.00469.x
PTPN11,N308D,"Although Noonan syndrome (NS) is occasionally associated with embryonal solid tumors, there has been no report of hepatoblastoma in NS. We identified hepatoblastoma spreading into bilateral hepatic lobes in a 1-month-old NS patient with a heterozygous PTPN11 mutation (Asn308Asp). This finding suggests the potential relevance of constitutively activated RAS/MAPK signaling in the development of hepatoblastoma.",10.1002/pbc.21509
PTPN11,N308D,"Noonan syndrome NS (OMIM 163950) is an autosomal dominant developmental disorder characterized mainly by typical facial dysmorphism, growth retardation and variable congenital heart defects. In unrelated individuals with sporadic or familial NS, heterozygous missense point mutations in the gene PTPN11 (OMIM 176876) have been confirmed, with a clustering of mutations in exons 3 and 8, the mutation A922G Asn308Asp accounting for nearly 25% of cases.
We report a 7-year-old boy with short stature and some other clinical features of NS, who has been investigated by molecular analysis for the presence of mutations in the PTPN11 gene.
The de novo mutation A172G in the exon 3 of the PTPN11 gene, predicting an Asn58Asp substitution, has been found. To the best of our knowledge, this specific mutation has only been described once before, but this is the first report of detailed clinical data suggesting a mild phenotype.
Detailed clinical phenotype in every patient with major or minor features of NS and molecular identification of PTPN11 gene mutation may contribute to a better phenotype-genotype correlation.",10.1159/000094145
PTPN11,N308D,"Mutations in the PTPN11 gene, which encodes the protein tyrosine phosphatase SHP-2, causes Noonan syndrome (NS), an autosomal dominant disorder with pleomorphic developmental abnormalities. Certain germline and somatic PTPN11 mutations cause leukemias. Mutations have gain-of-function (GOF) effects with the commonest NS allele, N308D, being weaker than the leukemia-causing mutations. To study the effects of disease-associated PTPN11 alleles, we generated transgenic fruitflies with GAL4-inducible expression of wild-type or mutant csw, the Drosophila orthologue of PTPN11. All three transgenic mutant CSWs rescued a hypomorphic csw allele's eye phenotype, documenting activity. Ubiquitous expression of two strong csw mutant alleles were lethal, but did not perturb development from some CSW-dependent receptor tyrosine kinase pathways. Ubiquitous expression of the weaker N308D allele caused ectopic wing veins, identical to the EGFR GOF phenotype. Epistatic analyses established that csw(N308D)'s ectopic wing vein phenotype required intact EGF ligand and receptor, and that this transgene interacted genetically with Notch, DPP and JAK/STAT signaling. Expression of the mutant csw transgenes increased RAS-MAP kinase activation, which was necessary but not sufficient for transducing their phenotypes. The findings from these fly models provided hypotheses testable in mammalian models, in which these signaling cassettes are largely conserved. In addition, these fly models can be used for sensitized screens to identify novel interacting genes as well as for high-throughput screening of therapeutic compounds for NS and PTPN11-related cancers.",10.1093/hmg/ddi471
PTPN11,N308D,"Noonan syndrome (NS) is an autosomal dominant disorder, characterized by short stature, minor facial anomalies, and congenital heart defects. In approximately 50% of cases the condition is caused by missense mutations in the PTPN11 gene on chromosome 12, resulting in a gain of function of the protein SHP-2. In this study, PTPN11 mutation analysis was performed in 170 NS patients. In 76 (45%) of them a mutation was identified. We report on the distribution of these mutations, as well as on genotype-phenotype relationships. The benefit of the NS scoring system developed by van der Burgt et al. [(1994); Am J Med Genet 53:187-191] is shown, among physicians who consequently based their diagnosis on the NS scoring system the percentage mutation positive subjects was 54%, whereas this percentage was only 39% among physicians who made less use of the scoring system. In two patients with some uncommon manifestations mutations were found in the C-SH2 domain, a region in which defects are not often identified in NS. A trend was observed in patients carrying the 922A --> G change (Asn308Asp) receiving normal education. In one patient with NS and mild juvenile myelomonocytic leukemia (JMML) the mutation 218C --> T (Thr73Ile) was found. This confirms previous findings indicating that individuals with NS with specific mutations in PTPN11 are at risk of developing JMML.",10.1002/ajmg.a.30598
PTPN11,N308D,"Noonan syndrome is an autosomal dominant disorder defined by short stature, delayed puberty, and characteristic dysmorphic features. Tartaglia et al. (Nature Genetics, 29:465-468) have recently shown that gain-of-function mutations in the gene PTPN11 (protein-tyrosine phosphatase, nonreceptor-type 11) cause Noonan syndrome in roughly half of patients that they examined. To further explore the relevance of PTPN11 mutations to the pathogenesis of Noonan syndrome, we analyzed the PTPN11 gene in 21 Japanese patients. Mutation analysis of the 15 coding exons and their flanking introns by denaturing HPLC and direct sequencing revealed six different heterozygous missense mutations (Asp61Gly, Tyr63Cys, Ala72Ser, Thr73Ile, Phe285Ser, and Asn308Asp) in seven cases (six sporadic and one familial). The mutations clustered either in the N-Src homology 2 domain or in the protein-tyrosine phosphatase domain. The clinical features of the mutation-positive and mutation-negative patients were comparable. The results provide further support to the notion that PTPN11 mutations are responsible for the development of Noonan syndrome in a substantial fraction of patients and that relatively infrequent features of Noonan syndrome, such as sensory deafness and bleeding diathesis, can also result from mutations of PTPN11.",10.1210/jcem.87.8.8694
PTPN11,T468M,"The 
We report a patient with short stature and osteogenesis imperfecta as the primary clinical manifestation. Other clinical features were peculiar facial features, deafness, and a history of recurrent fractures. Whole exome sequencing was performed on this patient.
After whole-exome sequencing, three mutations in two genes were identified that induced protein alterations associated with the patient's phenotype. One was a de novo variant c.1403C>T (p.Thr468Met) on exon 12 of the 
Concurrent mutations in ",10.3389/fped.2022.973920
PTPN11,T468M,,10.1111/ced.14644
PTPN11,T468M,,10.1111/1346-8138.13960
PTPN11,T468M,"Pathogenic mutations in genes (SASH1 and PTPN11) can cause a rare genetic disorder associated with pigmentation defects and the well-known LEOPARD syndrome, respectively. Both conditions presented with lentiginous phenotypes. The aim of this study was to arrive at definite diagnoses of three Chinese boys with clinically suspected lentigines-related syndromes. ADAR1, ABCB6, SASH1 and PTPN11 were candidate genes for mutational screening. Sanger sequencing was performed to identify the mutations, whereas bioinformatic analysis was used to predict the pathogenicity of novel missense mutations. Two novel mutations c.1537A>C (p.Ser513Arg) and 1527_1530dupAAGT (p.Leu511Lysfs*21) in SASH1 and a common p.Thr468Met mutation in PTPN11 were detected in three pediatric patients with lentiginous phenotypes, respectively. Comparisons between clinical presentations showed that SASH1-related phenotypes can exhibit hyper- and hypopigmentation on the trunk and extremities, similar to dyschromatosis, while scattered café au-lait spots usually appeared in PTPN11-related LEOPARD syndrome. Furthermore, the similarity in the clinical presentations of Peutz-Jeghers syndrome, Laugier-Hunziker syndrome, xeroderma pigmentosum, neurofibromatosis type I, suggesting that these conditions should be added into the differential diagnoses of lentiginous phenotypes.",10.1111/cge.12728
PTPN11,T468M,"LEOPARD syndrome (LS) is an autosomal dominant inherited disorder primarily caused by mutations in the PTPN11, RAF1 and BRAF genes. Characteristic features include lentigines, craniofacial dysmorphism, myocardium or valve abnormalities, eletrocardiographic conduction defects and deafness. LS, neurofibromatosis type 1, Noonan syndrome and Legius syndrome are a group of highly overlapped disorders termed 'RASopathies'. Therefore, clinical discrimination between these syndromes represents a huge challenge. The present study reports a young child diagnosed with LS via identification of a common p.Thr468Met mutation in PTPN11. Taking into account two Taiwanese LS cases with an identical mutation, Thr468Met is likely to be the most prevalent mutation in the Chinese population. Furthermore, this study suggests that a clinical diagnosis of LS should be considered for individuals with congenital cardiac defects and atypical lentigines (i.e., light brown freckles) scattered particularly on the face. ",10.3892/mmr.2016.5547
PTPN11,T468M,"A patient with Noonan syndrome with multiple lentigines (NSML) and multiple giant cell lesions (MGCL) in mandibles and maxillae is described. A mutation p.Thr468Met in the PTPN11-gene was found. This is the second reported NSML patient with MGCL. Our case adds to the assumption that, despite a different molecular pathogenesis and effect on the RAS/MEK pathway, NSML shares the development of MGCL, with other RASopathies. ",10.1016/j.ejmg.2016.05.013
PTPN11,T468M,"RASopathies comprise several genetic syndromes with mainly cardio-facial-cutaneous manifestations. We report a patient with Noonan syndrome with multiple lentigines (NSML) due to a PTPN11 (p.Thr468Met) mutation associated with hypertrophic neuropathy of lumbar plexus in an adult woman, initially referred for neuropathic pain. Differential diagnosis of neurofibromatosis type 1 (NF1) and other RASopathies is difficult without molecular testing. © 2016 Wiley Periodicals, Inc.",10.1002/ajmg.a.37601
PTPN11,T468M,"SHP2, encoded by the PTPN11 gene, is a protein tyrosine phosphatase that plays a key role in the proliferation of cells via RAS-ERK activation. SHP2 also promotes Wnt signaling by dephosphorylating parafibromin. Germline missense mutations of PTPN11 are found in more than half of patients with Noonan syndrome (NS) and LEOPARD syndrome (LS), both of which are congenital developmental disorders with multiple common symptoms. However, whereas NS-associated PTPN11 mutations give rise to gain-of-function SHP2 mutants, LS-associated SHP2 mutants are reportedly loss-of-function mutants. To determine the phosphatase activity of LS-associated SHP2 more appropriately, we performed an in vitro phosphatase assay using tyrosine-phosphorylated parafibromin, a biologically relevant substrate of SHP2 and the positive regulator of Wnt signaling that is activated through SHP2-mediated dephosphorylation. We found that LS-associated SHP2 mutants (Y279C, T468M, Q506P, and Q510E) exhibited a substantially reduced phosphatase activity toward parafibromin when compared with wild-type SHP2. Furthermore, each of the LS-associated mutants displayed a differential degree of decrease in phosphatase activity. Deviation of the SHP2 catalytic activity from a certain range, either too strong or too weak, may therefore lead to similar clinical outcomes in NS and LS, possibly through an imbalanced Wnt signal caused by inadequate dephosphorylation of parafibromin.",10.1016/j.bbrc.2015.12.117
PTPN11,T468M,"Noonan syndrome with multiple lentigines (NSML), formerly known as LEOPARD syndrome, is an autosomal-dominant disorder characterised by lentigines, EKG abnormalities, ocular hypertelorism, pulmonic stenosis, abnormal genitalia, growth retardation and deafness. There is significant clinical overlap between NSML and other disorders that result from dysregulated rat sarcoma/mitogen-activated protein kinase pathway (RASopathies). Except for neurofibromatosis type 1, other RASopathies are not known to be typically associated with neurogenic tumours.
We evaluated patients from three families with pigmentary skin lesions, progressive neuropathy, enlarged nerves, massive burden of paraspinal tumours (neurofibroma was confirmed in one patient) and a clinical diagnosis of NSML. All patients had a mutation in the protein tyrosine phosphatase catalytic domain of the PTPN11 gene; two unrelated patients had the p.Thr468Met mutation, while the family consisting of two affected individuals harboured the p.Thr279Cys mutation. Molecular analysis performed on hypertrophic nerve tissue did not disclose a second somatic hit in NF1, PTPN11, NF2 or SMARCB1 genes.
Neurogenic tumours and hypertrophic neuropathy are unusual complications of NSML and may be an under-recognised manifestation that would warrant surveillance. Our observation may also have implications for other disorders caused by RAS-pathway dysregulation.",10.1136/jmedgenet-2015-103177
PTPN11,T468M,"LEOPARD syndrome (multiple Lentigines, Electrocardiographic conduction abnormalities, Ocular hypertelorism, Pulmonary stenosis, Abnormal genitalia, Retardation of growth, sensorineural Deafness; LS), also called Noonan syndrome with multiple lentigines (NSML), is a rare autosomal dominant disorder associating various developmental defects, notably cardiopathies, dysmorphism, and short stature. It is mainly caused by mutations of the PTPN11 gene that catalytically inactivate the tyrosine phosphatase SHP2 (Src-homology 2 domain-containing phosphatase 2). Besides its pleiotropic roles during development, SHP2 plays key functions in energetic metabolism regulation. However, the metabolic outcomes of LS mutations have never been examined. Therefore, we performed an extensive metabolic exploration of an original LS mouse model, expressing the T468M mutation of SHP2, frequently borne by LS patients. Our results reveal that, besides expected symptoms, LS animals display a strong reduction of adiposity and resistance to diet-induced obesity, associated with overall better metabolic profile. We provide evidence that LS mutant expression impairs adipogenesis, triggers energy expenditure, and enhances insulin signaling, three features that can contribute to the lean phenotype of LS mice. Interestingly, chronic treatment of LS mice with low doses of MEK inhibitor, but not rapamycin, resulted in weight and adiposity gains. Importantly, preliminary data in a French cohort of LS patients suggests that most of them have lower-than-average body mass index, associated, for tested patients, with reduced adiposity. Altogether, these findings unravel previously unidentified characteristics for LS, which could represent a metabolic benefit for patients, but may also participate to the development or worsening of some traits of the disease. Beyond LS, they also highlight a protective role of SHP2 global LS-mimicking modulation toward the development of obesity and associated disorders. ",10.1073/pnas.1406107111
PTPN11,T468M,"LEOPARD syndrome is an autosomal dominant condition related to Noonan syndrome, although it occurs less frequently. The aim of this study was to characterize the clinical and molecular features of a large series of LEOPARD syndrome patients.
We collected clinical data from 19 patients in 10 hospitals. Bidirectional sequencing analysis of PTPN11, RAF1, and BRAF focused on exons carrying recurrent mutations.
After facial dysmorphism, structural heart defects (88%) were the most common feature described. Hypertrophic cardiomyopathy (71%) was diagnosed more often than pulmonary valve stenosis (35%). Multiple lentigines or café au lait spots were found in 84% of the series, and deafness was diagnosed in 3 patients. Mutations in PTPN11 were identified in 16 (84%) patients (10 patients had the recurrent LEOPARD syndrome mutation, p.Thr468Met) (NP_002825.3T468M). Two other patients had a mutation in RAF, and 1 patient had a mutation in BRAF. When compared with other neurocardiofaciocutaneous syndromes, LEOPARD syndrome patients showed a higher prevalence of hypertrophic cardiomyopathy and cutaneous abnormalities, and a lower prevalence of pulmonary valve stenosis and short stature.
LEOPARD syndrome patients display distinctive features apart from multiple lentigines, such as a higher prevalence of hypertrophic cardiomyopathy and lower prevalence of short stature. Given its clinical implications, active search for hypertrophic cardiomyopathy is warranted in Noonan syndrome spectrum patients, especially in LEOPARD syndrome patients.",10.1016/j.rec.2012.09.015
PTPN11,T468M,"Diagnosis within RASopathies still represents a challenge. Nevertheless, many efforts have been made by clinicians to identify specific clinical features which might help in differentiating one disorder from another. Here, we describe a child initially diagnosed with Neurofibromatosis-Noonan syndrome. The follow-up of the proband, the clinical evaluation of his father together with a gene-by-gene testing approach led us to the proper diagnosis.
We report a 8-year-old male with multiple café-au-lait macules, several lentigines and dysmorphic features that suggest Noonan syndrome initially diagnosed with Neurofibromatosis-Noonan syndrome. However, after a few years of clinical and ophthalmological follow-up, the absence of typical features of Neurofibromatosis type 1 and the lack of NF1 mutation led us to reconsider the original diagnosis. A new examination of the patient and his similarly affected father, who was initially referred as healthy, led us to suspect LEOPARD syndrome, The diagnosis was then confirmed by the occurrence in both patients of a heterozygous mutation c.1403 C > T, p.(Thr468Met), of PTPN11. Subsequently, the proband was also found to have type-1 Arnold-Chiari malformation in association with syringomyelia.
Our experience suggests that differential clinical diagnosis among RASopathies remains ambiguous and raises doubts on the current diagnostic clinical criteria. In some cases, genetic tests represent the only conclusive proof for a correct diagnosis and, consequently, for establishing individual prognosis and providing adequate follow-up. Thus, molecular testing represents an essential tool in differential diagnosis of RASophaties. This view is further strengthened by the increasing accessibility of new sequencing techniques.Finally, to our knowledge, the described case represents the third report of the occurrence of Arnold Chiari malformation and the second description of syringomyelia with LEOPARD syndrome.",10.1186/1471-2350-15-44
PTPN11,T468M,"Medulloblastoma is the commonest brain tumor in childhood and in a minority of patients is associated with an underlying genetic disorder such as Gorlin syndrome or familial adenomatous polyposis. Increased susceptibility to certain tumors, including neuroblastoma and some hematological malignancies, is recognized in disorders caused by mutations in genes encoding components of the RAS signaling pathway which include Noonan syndrome, Noonan syndrome with multiple lentigines (NSML; formerly called LEOPARD syndrome), Costello syndrome, Cardiofaciocutaneous syndrome, Legius syndrome, and Neurofibromatosis type 1 (NF1), collectively termed RASopathies. Although an association between medulloblastoma and NF1 has been reported, this tumor has not previously been reported in other RASopathies. We present a patient with NSML caused by the recurrent PTPN11 mutation c.1403C > T (p.Thr468Met) in whom medulloblastoma was diagnosed at age 10 years. Medulloblastoma could therefore be part of the tumor spectrum associated with this disorder.",10.1002/ajmg.a.36005
PTPN11,T468M,"The RAS/MAPK pathway proteins with germline mutations in their respective genes are associated with some disorders such as Noonan, LEOPARD (LS), neurofibromatosis type 1, Costello and cardio-facio-cutaneous syndromes. LEOPARD is an acronym, mnemonic for the major manifestations of this disorder, characterized by multiple lentigines, electrocardiographic abnormalities, ocular hypertelorism, pulmonic stenosis, abnormal genitalia, retardation of growth, and sensorineural deafness. Though it is not included in the acronym, hypertrophic cardiomyopathy is the most frequent cardiac anomaly observed, representing a potentially life-threatening problem in these patients. PTPN11, RAF1 and BRAF are the genes known to be associated with LS, identifying molecular genetic testing of the 3 gene mutations in about 95% of affected individuals. PTPN11 mutations are the most frequently found. Eleven different missense PTPN11 mutations (Tyr279Cys/Ser, Ala461Thr, Gly464Ala, Thr468Met/Pro, Arg498Trp/Leu, Gln506Pro, and Gln510Glu/Pro) have been reported so far in LS, 2 of which (Tyr279Cys and Thr468Met) occur in about 65% of the cases. Here, we provide an overview of clinical aspects of this disorder, the molecular mechanisms underlying pathogenesis and major genotype-phenotype correlations.",10.1159/000342251
PTPN11,T468M,"The RAS-MAPK pathway is critical for human growth and development. Abnormalities at different steps of this signaling cascade result in neuro-cardio-facial-cutaneous syndromes, or the RASopathies, a group of disorders with overlapping yet distinct phenotypes. RASopathy patients have variable degrees of intellectual disability, poor growth, relative macrocephaly, ectodermal abnormalities, dysmorphic features, and increased risk for certain malignancies. Congenital heart disease, particularly hypertrophic cardiomyopathy (HCM) and pulmonic stenosis, are prominent features in these disorders. Significant locus heterogeneity exists for many of the RASopathies. Traditionally, these diseases were thought to be inherited in an autosomal dominant manner. However, recently patients with defects in two components of this pathway and overlapping features of various forms of Noonan syndrome and neurofibromatosis 1 and have been reported. Here we present a patient with severe, progressive neonatal HCM, elevated urinary catecholamine metabolites, and dysmorphic features in whom we identified a known LEOPARD syndrome-associated PTPN11 mutation (c.1403 C > T; p.T468M) and a novel, potentially pathogenic missense SOS1 variant (c.1018 C > T; p.P340S) replacing a rigid nonpolar imino acid with a polar amino acid at a highly conserved position. We describe detailed clinical manifestations, cardiac histopathology, and the molecular genetic findings. Oligogenic models of inheritance with potential synergistic effects should be considered in the RASopathies.",10.1002/ajmg.a.35363
PTPN11,T468M,"Noonan syndrome (NS) and neurofibromatosis type 1 (NF1) are well-defined entities. The association of both disorders is called neurofibromatosis-Noonan syndrome (NFNS), a disorder that has been related to mutations in the NF1 gene. Both NS and NFNS display phenotypic overlapping with LEOPARD syndrome (LS), and differential diagnosis between these two entities often represents a challenge for clinicians. We report on three patients (two brothers and a not-related patient) diagnosed as having NFNS. They fulfilled NF1 diagnostic criteria and had some features of NS. The three of them had hypertophic cardiomyopathy while neurofibromas, Lisch nodules, and unidentified bright objects on MRI were absent. PTPN11 gene assays revealed a T468M mutation, typical of LS. Thorough clinical examinations of the patients revealed multiple lentigines, which were considered to be freckling in the initial evaluation. We conclude that NF1 clinical criteria should be used with caution in patients with features of NS. Patients with hyperpigmented cutaneous spots associated with cardiac anomalies, even if fulfilling the minimal NF1 criteria for diagnosis, should be strongly considered for LS diagnosis.",10.1007/s00431-011-1418-5
